{
  "fccId": "321cba",
  "cbsdCategory": "A",
  "callSign": "KPPP",
  "userId": "John Doe",
  "airInterface": {
    "radioTechnology": "E-UTRA",
    "supportedSpec": "LTE-Rel10"
  },
  "cbsdManufacturer": "Equipment Maker C",
  "cbsdSerialNumber": "4321dcba",
  "maximumGrants": 2,
  "sensingCapability": [
    "receivedInterferencePower"
  ],
  "installationParam": {
    "latitude": 37.425056,
    "longitude": -122.084113,
    "height": 9.3,
    "indoorDeployment": false,
    "antennaAzimuth": 270.5,
    "antennaDowntiltMech": 3,
    "antennaGain": 16,
    "antennaBeamwidth": 30
  }
}

